{
  "topic_slug": "crypto",
  "date_key": "2025-01-16",
  "page_state": "pending",
  "display_name": "Crypto",
  "alert_count": 0,
  "cluster_count": 0,
  "summary_available": 0,
  "video_available": 0,
  "article_available": 0,
  "prev_date_key": null,
  "next_date_key": null,
  "published_at": null
}
