{
  "topic_slug": "finance",
  "date_key": "2025-01-15",
  "page_state": "published",
  "display_name": "Finance",
  "alert_count": 3,
  "cluster_count": 1,
  "summary_available": 1,
  "video_available": 0,
  "article_available": 1,
  "prev_date_key": null,
  "next_date_key": null,
  "published_at": "2025-01-15T23:00:00Z"
}
